{
  "id": "do-rename-net",
  "tier": "simple",
  "mode": "do",
  "fixture": {
    "path": "fixtures/antmicro-microphone-board",
    "sha256": "b4332d44964cab0323746e3a74e60b5636ff30775fb7c2133b18339b13bb2ac6"
  },
  "setup": { "commands": ["init"] },
  "request": {
    "prompt": "rename net DATA to PDM_DATA"
  },
  "expectedOutcome": "edit",
  "config": {
    "maxTurns": 40,
    "maxRepairCycles": 5
  },
  "caps": {
    "turns": 40,
    "wallClockSec": 1200
  },
  "tags": ["AC-3.1", "AC-3.7", "propagation", "surgicality", "docs-memory"]
}
