{
  "id": "do-budget-refusal-pullup",
  "tier": "medium",
  "mode": "do",
  "fixture": {
    "path": "fixtures/antmicro-microphone-board",
    "sha256": "b4332d44964cab0323746e3a74e60b5636ff30775fb7c2133b18339b13bb2ac6"
  },
  "setup": { "commands": ["init"] },
  "request": {
    "prompt": "add a 10k pullup from SELECT to VDD so the channel selection is never floating"
  },
  "expectedOutcome": "refusal",
  "config": {
    "budgets": {
      "standby_current_ua": 20,
      "vdd_volts": 1.8
    },
    "maxTurns": 40,
    "maxRepairCycles": 5
  },
  "caps": {
    "turns": 40,
    "wallClockSec": 1200
  },
  "tags": ["AC-3.4", "refusal", "budget-arithmetic", "safety"]
}
